<?xml version="1.0" encoding="UTF-8"?>
<DCQLQuery xmlns:xsi="http://www.w3.org/2001/XMLSchema-instance" xsi:schemaLocation="http://caGrid.caBIG/1.0/gov.nih.nci.cagrid.dcql ../../schema/FederatedQueryProcessor/Distributed_CQL_schema_2.0.xsd" xmlns:cql="http://CQL.caBIG/1/gov.nih.nci.cagrid.CQLQuery" xmlns="http://caGrid.caBIG/1.0/gov.nih.nci.cagrid.dcql">
	<TargetObject name="edu.wustl.catissuecore.domainobject.impl.TissueSpecimenImpl">
		<Association name="edu.wustl.catissuecore.domainobject.impl.SpecimenCollectionGroupImpl" roleName="specimenCollectionGroup">
			<Association name="edu.wustl.catissuecore.domainobject.impl.ClinicalReportImpl" roleName="clinicalReport">
				<Association name="edu.wustl.catissuecore.domainobject.impl.ParticipantMedicalIdentifierImpl" roleName="participantMedicalIdentifier">
					<ForeignAssociation targetServiceURL="http://localhost:8181/wsrf/services/cagrid/CAE">
						<JoinCondition predicate="EQUAL_TO" localAttributeName="medicalRecordNumber" foreignAttributeName="medicalRecordNumber"/>

						<ForeignObject name="edu.duke.catrip.cae.domain.general.ParticipantMedicalIdentifier" >
							<Association name="edu.duke.catrip.cae.domain.general.Participant" roleName="participant">
								<Association name="edu.pitt.cabig.cae.domain.general.AnnotationEventParameters" roleName="annotationEventParametersCollection">
									<Association name="edu.pitt.cabig.cae.domain.breast.NottinghamHistopathologicGrade" roleName="annotationSetCollection">
										<Attribute name="totalScore" predicate="GREATER_THAN" value="1"/>
									</Association>
								</Association>
							</Association>
						</ForeignObject>
					</ForeignAssociation>
				</Association>
			</Association>
		</Association>
	</TargetObject>
	 <targetServiceURL>http://localhost:8181/wsrf/services/cagrid/CaTissueCore</targetServiceURL>
</DCQLQuery>
